[
  {
    "id": "transfer-function-definition",
    "title": "Transfer Function Definition",
    "category": "Control Theory",
    "subcategory": "Transfer Functions",
    "latex": "G(s)=\\frac{Y(s)}{U(s)}",
    "description": "Transfer function as the ratio of output to input in the Laplace domain.",
    "tags": [
      "control",
      "transfer-function",
      "laplace"
    ]
  },
  {
    "id": "closed-loop-transfer-function",
    "title": "Closed-Loop Transfer Function",
    "category": "Control Theory",
    "subcategory": "Transfer Functions",
    "latex": "T(s)=\\frac{G(s)}{1+G(s)H(s)}",
    "description": "Closed-loop transfer function for negative feedback.",
    "tags": [
      "control",
      "feedback",
      "closed-loop"
    ]
  }
]
