[
  {
    "id": "continuous-fourier-transform",
    "title": "Continuous Fourier Transform",
    "category": "Signal Processing",
    "subcategory": "Fourier Analysis",
    "latex": "X(\\omega)=\\int_{-\\infty}^{\\infty}x(t)e^{-j\\omega t}\\,dt",
    "description": "Continuous-time Fourier transform.",
    "tags": [
      "signal-processing",
      "fourier",
      "frequency-domain"
    ]
  },
  {
    "id": "inverse-continuous-fourier-transform",
    "title": "Inverse Continuous Fourier Transform",
    "category": "Signal Processing",
    "subcategory": "Fourier Analysis",
    "latex": "x(t)=\\frac{1}{2\\pi}\\int_{-\\infty}^{\\infty}X(\\omega)e^{j\\omega t}\\,d\\omega",
    "description": "Inverse continuous-time Fourier transform.",
    "tags": [
      "signal-processing",
      "fourier",
      "inverse-transform"
    ]
  }
]
