[
  {
    "id": "continuous-convolution",
    "title": "Continuous Convolution",
    "category": "Signal Processing",
    "subcategory": "Convolution",
    "latex": "y(t)=(x*h)(t)=\\int_{-\\infty}^{\\infty}x(\\tau)h(t-\\tau)\\,d\\tau",
    "description": "Continuous-time convolution of a signal and impulse response.",
    "tags": [
      "signal-processing",
      "convolution",
      "systems"
    ]
  },
  {
    "id": "discrete-convolution",
    "title": "Discrete Convolution",
    "category": "Signal Processing",
    "subcategory": "Convolution",
    "latex": "y[n]=(x*h)[n]=\\sum_{k=-\\infty}^{\\infty}x[k]h[n-k]",
    "description": "Discrete-time convolution sum.",
    "tags": [
      "signal-processing",
      "convolution",
      "discrete-time"
    ]
  }
]
