[
  {
    "id": "lyapunov-equation",
    "title": "Lyapunov Equation",
    "category": "Control Theory",
    "subcategory": "Stability",
    "latex": "\\mathbf{A}^T\\mathbf{P}+\\mathbf{P}\\mathbf{A}=-\\mathbf{Q}",
    "description": "Continuous-time Lyapunov equation for stability analysis.",
    "tags": [
      "control",
      "stability",
      "lyapunov"
    ]
  }
]
