[
  {
    "id": "rgb-to-luma",
    "title": "RGB to Luma",
    "category": "Image Processing",
    "subcategory": "Color Spaces",
    "latex": "Y=0.299R+0.587G+0.114B",
    "description": "Common luma approximation from RGB channels.",
    "tags": [
      "image-processing",
      "color",
      "luma"
    ]
  }
]
