[
  {
    "id": "gradient-magnitude",
    "title": "Gradient Magnitude",
    "category": "Image Processing",
    "subcategory": "Edge Detection",
    "latex": "|\\nabla I|=\\sqrt{I_x^2+I_y^2}",
    "description": "Image gradient magnitude used for edge strength.",
    "tags": [
      "image-processing",
      "edge-detection",
      "gradient"
    ]
  },
  {
    "id": "sobel-gradient",
    "title": "Sobel Gradient",
    "category": "Image Processing",
    "subcategory": "Edge Detection",
    "latex": "G=\\sqrt{G_x^2+G_y^2},\\qquad \\theta=\\operatorname{atan2}(G_y,G_x)",
    "description": "Gradient magnitude and orientation from Sobel responses.",
    "tags": [
      "image-processing",
      "sobel",
      "edge-detection"
    ]
  }
]
