[
  {
    "id": "two-dimensional-discrete-fourier-transform",
    "title": "Two-Dimensional Discrete Fourier Transform",
    "category": "Image Processing",
    "subcategory": "Image Transforms",
    "latex": "F(u,v)=\\sum_{x=0}^{M-1}\\sum_{y=0}^{N-1}f(x,y)e^{-j2\\pi\\left(\\frac{ux}{M}+\\frac{vy}{N}\\right)}",
    "description": "2D DFT used for image frequency analysis.",
    "tags": [
      "image-processing",
      "fourier",
      "frequency-domain"
    ]
  }
]
