[
  {
    "id": "z-transform",
    "title": "Z-Transform",
    "category": "Signal Processing",
    "subcategory": "Z Transform",
    "latex": "X(z)=\\sum_{n=-\\infty}^{\\infty}x[n]z^{-n}",
    "description": "Bilateral Z-transform of a discrete-time signal.",
    "tags": [
      "signal-processing",
      "z-transform",
      "discrete-time"
    ]
  },
  {
    "id": "digital-filter-transfer-function",
    "title": "Digital Filter Transfer Function",
    "category": "Signal Processing",
    "subcategory": "Z Transform",
    "latex": "H(z)=\\frac{\\sum_{k=0}^{M}b_k z^{-k}}{1+\\sum_{k=1}^{N}a_k z^{-k}}",
    "description": "Rational transfer function for a digital filter.",
    "tags": [
      "signal-processing",
      "filter",
      "z-transform"
    ]
  }
]
