[
  {
    "id": "cross-correlation",
    "title": "Cross-Correlation",
    "category": "Signal Processing",
    "subcategory": "Correlation",
    "latex": "R_{xy}(\\tau)=\\int_{-\\infty}^{\\infty}x(t)y^*(t-\\tau)\\,dt",
    "description": "Continuous-time cross-correlation.",
    "tags": [
      "signal-processing",
      "correlation",
      "similarity"
    ]
  }
]
